{
  "$schema": "http://json-schema.org/draft-07/schema#",
  "title": "OpenCoT Multi-Verifier Ensemble v0.1",
  "type": "object",
  "properties": {
    "version": {
      "type": "string",
      "enum": [
        "0.1"
      ],
      "description": "Schema version."
    },
    "trace_id": {
      "type": "string",
      "description": "ID linking to a reasoning trace (RFC 0001)."
    },
    "verifier_outputs": {
      "type": "array",
      "description": "List of raw verifier outputs (RFC 0002).",
      "items": {
        "type": "object",
        "description": "A single verifier's output."
      }
    },
    "fusion_strategy": {
      "type": "string",
      "enum": [
        "majority_vote",
        "weighted_vote",
        "confidence_weighted",
        "max_confidence",
        "min_confidence",
        "average_reward",
        "custom"
      ],
      "description": "Strategy used to combine verifier outputs."
    },
    "weights": {
      "type": "object",
      "description": "Optional weights for weighted fusion strategies.",
      "additionalProperties": {
        "type": "number"
      }
    },
    "fused_step_results": {
      "type": "array",
      "description": "Final correctness judgments per step.",
      "items": {
        "type": "object",
        "properties": {
          "step_id": {
            "type": "string"
          },
          "correct": {
            "type": "string",
            "enum": [
              "true",
              "false",
              "unknown"
            ]
          },
          "confidence": {
            "type": "number",
            "minimum": 0,
            "maximum": 1
          }
        },
        "required": [
          "step_id",
          "correct"
        ]
      }
    },
    "fused_rewards": {
      "type": "array",
      "description": "Final reward values per step (RFC 0005).",
      "items": {
        "type": "object",
        "properties": {
          "step_id": {
            "type": "string"
          },
          "reward": {
            "type": "number"
          }
        },
        "required": [
          "step_id",
          "reward"
        ]
      }
    },
    "disagreement_metrics": {
      "type": "object",
      "description": "Optional diagnostics about verifier disagreement.",
      "properties": {
        "num_verifiers": {
          "type": "number"
        },
        "num_disagreements": {
          "type": "number"
        },
        "disagreement_rate": {
          "type": "number"
        }
      }
    }
  },
  "required": [
    "version",
    "verifier_outputs",
    "fusion_strategy"
  ],
  "$id": "https://opencot.dev/schemas/rfc-0006-ensemble.json",
  "x-opencot": {
    "rfc": "0006",
    "shortname": "ensemble",
    "source_rfc": "rfcs/0006-multi-verifier-ensemble-schema.md"
  }
}
